[
  {
    "id": "make",
    "name": "GNU Make",
    "type": "cli",
    "category": ["automation", "build"],
    "languages": [],
    "description": "Classic build automation tool — define targets with dependencies in a Makefile for reproducible project workflows and task orchestration",
    "when_to_use": "Standard project automation, defining build/test/deploy targets, when a Makefile already exists in the project",
    "install": { "command": "Pre-installed on most Unix systems || brew install make || sudo apt install make", "binary_name": "make" },
    "run": { "command": "make", "common_flags": ["<target>", "-j$(nproc)", "-f <Makefile>", "-n (dry run)", "-B (force)", "VARIABLE=value"] },
    "risk_level": "medium",
    "requires": [],
    "cli_support": ["claude", "gemini", "opencode", "codex"],
    "tags": ["build", "automation", "task-runner", "makefile", "classic"],
    "github": "https://savannah.gnu.org/projects/make",
    "security": { "trust_level": "verified", "last_checked": "2026-04-03" }
  },
  {
    "id": "just",
    "name": "just",
    "type": "cli",
    "category": ["automation"],
    "languages": [],
    "description": "Modern command runner — like make but focused purely on running project commands without build system complexity, using a simple justfile syntax",
    "when_to_use": "Defining project commands (build, test, lint, deploy), replacing Makefiles when you only need task running without dependency graphs",
    "install": { "command": "brew install just || cargo install just", "binary_name": "just" },
    "run": { "command": "just", "common_flags": ["<recipe>", "--list", "--dry-run", "--set <var> <value>", "-f <justfile>", "--choose"] },
    "risk_level": "low",
    "requires": [],
    "cli_support": ["claude", "gemini", "opencode", "codex"],
    "tags": ["task-runner", "automation", "commands", "justfile"],
    "github": "https://github.com/casey/just",
    "security": { "trust_level": "verified", "last_checked": "2026-04-03" }
  },
  {
    "id": "task",
    "name": "Task (go-task)",
    "type": "cli",
    "category": ["automation"],
    "languages": [],
    "description": "Task runner and build tool written in Go — YAML-based Taskfiles with dependency management, file-based caching, and cross-platform support",
    "when_to_use": "Project automation with YAML config, when you want a modern Make alternative with built-in file change detection and task dependencies",
    "install": { "command": "brew install go-task || sh -c \"$(curl --location https://taskfile.dev/install.sh)\" -- -d -b /usr/local/bin", "binary_name": "task" },
    "run": { "command": "task", "common_flags": ["<task>", "--list", "--dry", "--force", "--parallel", "--watch", "-t Taskfile.yml"] },
    "risk_level": "low",
    "requires": [],
    "cli_support": ["claude", "gemini", "opencode", "codex"],
    "tags": ["task-runner", "automation", "yaml", "cross-platform", "go"],
    "github": "https://github.com/go-task/task",
    "security": { "trust_level": "verified", "last_checked": "2026-04-03" }
  },
  {
    "id": "mise",
    "name": "mise",
    "type": "cli",
    "category": ["automation"],
    "languages": [],
    "description": "Polyglot runtime and tool version manager — manages Node, Python, Rust, Go, and 200+ tools per-project with .mise.toml, plus a task runner",
    "when_to_use": "Managing tool versions across projects (replaces nvm, pyenv, rbenv), ensuring consistent dev environments, running project tasks",
    "install": { "command": "brew install mise || curl https://mise.run | sh", "binary_name": "mise" },
    "run": { "command": "mise", "common_flags": ["install", "use node@22", "use python@3.12", "ls", "run <task>", "exec -- <command>", "trust"] },
    "risk_level": "medium",
    "requires": [],
    "cli_support": ["claude", "gemini", "opencode", "codex"],
    "tags": ["version-manager", "runtime", "polyglot", "dev-environment", "task-runner"],
    "github": "https://github.com/jdx/mise",
    "security": { "trust_level": "verified", "last_checked": "2026-04-03" }
  },
  {
    "id": "direnv",
    "name": "direnv",
    "type": "cli",
    "category": ["automation"],
    "languages": [],
    "description": "Automatic environment variable manager — loads and unloads environment variables based on the current directory using .envrc files",
    "when_to_use": "Per-project environment configuration, auto-loading secrets and paths when entering a directory, managing dev environment variables",
    "install": { "command": "brew install direnv || sudo apt install direnv", "binary_name": "direnv" },
    "run": { "command": "direnv", "common_flags": ["allow", "deny", "edit", "status", "exec <dir> <command>", "reload"] },
    "risk_level": "medium",
    "requires": [],
    "cli_support": ["claude", "gemini", "opencode", "codex"],
    "tags": ["environment", "env-vars", "per-project", "shell", "automation"],
    "github": "https://github.com/direnv/direnv",
    "security": { "trust_level": "verified", "last_checked": "2026-04-03" }
  }
]
