[
  {
    "id": "prometheus",
    "name": "Prometheus",
    "type": "cli",
    "category": ["monitoring"],
    "languages": [],
    "description": "Open-source monitoring and alerting toolkit — pull-based metrics collection with PromQL query language, time-series storage, and alerting rules",
    "when_to_use": "Collecting and querying application metrics, setting up alerting rules, monitoring infrastructure and service health",
    "install": { "command": "brew install prometheus || curl -sLO https://github.com/prometheus/prometheus/releases/latest/download/prometheus-linux-amd64.tar.gz && tar xzf prometheus-*.tar.gz", "binary_name": "prometheus" },
    "run": { "command": "prometheus", "common_flags": ["--config.file=prometheus.yml", "--web.listen-address=:9090", "--storage.tsdb.retention.time=15d", "--web.enable-lifecycle"] },
    "risk_level": "medium",
    "requires": [],
    "cli_support": ["claude", "gemini", "opencode", "codex"],
    "tags": ["monitoring", "metrics", "alerting", "promql", "time-series"],
    "github": "https://github.com/prometheus/prometheus",
    "security": { "trust_level": "verified", "last_checked": "2026-04-03" }
  },
  {
    "id": "grafana-cli",
    "name": "Grafana CLI",
    "type": "cli",
    "category": ["monitoring"],
    "languages": [],
    "description": "CLI for Grafana observability platform — manage plugins, data sources, dashboards, and server configuration from the terminal",
    "when_to_use": "Managing Grafana plugins and dashboards, automating dashboard provisioning, configuring data sources in CI/CD",
    "install": { "command": "brew install grafana || sudo apt install grafana", "binary_name": "grafana-cli" },
    "run": { "command": "grafana-cli", "common_flags": ["plugins install <name>", "plugins ls", "admin reset-admin-password <pw>", "plugins update-all"] },
    "risk_level": "medium",
    "requires": [],
    "cli_support": ["claude", "gemini", "opencode", "codex"],
    "tags": ["monitoring", "dashboards", "visualization", "observability", "plugins"],
    "github": "https://github.com/grafana/grafana",
    "security": { "trust_level": "verified", "last_checked": "2026-04-03" }
  },
  {
    "id": "jaeger",
    "name": "Jaeger",
    "type": "cli",
    "category": ["monitoring"],
    "languages": [],
    "description": "Distributed tracing platform — collects, stores, and visualizes request traces across microservices for latency analysis and root cause debugging",
    "when_to_use": "Tracing requests across microservices, identifying latency bottlenecks, debugging distributed system failures",
    "install": { "command": "brew install jaeger || docker run -d -p 16686:16686 -p 4317:4317 jaegertracing/all-in-one:latest", "binary_name": "jaeger-all-in-one" },
    "run": { "command": "jaeger-all-in-one", "common_flags": ["--collector.otlp.enabled=true", "--query.base-path=/jaeger", "--memory.max-traces=20000"] },
    "risk_level": "medium",
    "requires": [],
    "cli_support": ["claude", "gemini", "opencode", "codex"],
    "tags": ["monitoring", "tracing", "distributed", "microservices", "observability"],
    "github": "https://github.com/jaegertracing/jaeger",
    "security": { "trust_level": "verified", "last_checked": "2026-04-03" }
  },
  {
    "id": "otel-collector",
    "name": "OpenTelemetry Collector",
    "type": "cli",
    "category": ["monitoring"],
    "languages": [],
    "description": "Vendor-agnostic telemetry pipeline — receives, processes, and exports traces, metrics, and logs to any observability backend",
    "when_to_use": "Centralizing telemetry collection, routing traces/metrics/logs to multiple backends, transforming and filtering telemetry data",
    "install": { "command": "brew install open-telemetry/opentelemetry-collector/opentelemetry-collector || curl -sLO https://github.com/open-telemetry/opentelemetry-collector-releases/releases/latest/download/otelcol_linux_amd64.tar.gz && tar xzf otelcol_*.tar.gz", "binary_name": "otelcol" },
    "run": { "command": "otelcol", "common_flags": ["--config config.yaml", "validate --config config.yaml", "components"] },
    "risk_level": "medium",
    "requires": [],
    "cli_support": ["claude", "gemini", "opencode", "codex"],
    "tags": ["monitoring", "telemetry", "traces", "metrics", "logs", "vendor-agnostic"],
    "github": "https://github.com/open-telemetry/opentelemetry-collector",
    "security": { "trust_level": "verified", "last_checked": "2026-04-03" }
  },
  {
    "id": "vector",
    "name": "Vector",
    "type": "cli",
    "category": ["monitoring"],
    "languages": [],
    "description": "High-performance observability data pipeline — collects, transforms, and routes logs, metrics, and traces with a declarative TOML/YAML config",
    "when_to_use": "Log aggregation, metrics routing, replacing Logstash/Fluentd with a faster Rust-based alternative, transforming telemetry data",
    "install": { "command": "brew install vectordotdev/brew/vector || curl --proto '=https' --tlsv1.2 -sSf https://sh.vector.dev | bash", "binary_name": "vector" },
    "run": { "command": "vector", "common_flags": ["--config vector.toml", "validate --config vector.toml", "top", "tap <component>", "generate <source> <transform> <sink>"] },
    "risk_level": "medium",
    "requires": [],
    "cli_support": ["claude", "gemini", "opencode", "codex"],
    "tags": ["monitoring", "logs", "metrics", "pipeline", "rust", "observability"],
    "github": "https://github.com/vectordotdev/vector",
    "security": { "trust_level": "verified", "last_checked": "2026-04-03" }
  }
]
