[
  {
    "id": "mcp-filesystem",
    "name": "Filesystem MCP",
    "type": "mcp",
    "category": ["filesystem"],
    "languages": [],
    "description": "Read, write, and manage files and directories through MCP",
    "when_to_use": "When the AI assistant needs direct filesystem access beyond what the CLI provides",
    "install": { "command": "npx -y @modelcontextprotocol/server-filesystem", "package_manager": "npm" },
    "run": { "command": "npx @modelcontextprotocol/server-filesystem <allowed_dir>" },
    "risk_level": "medium",
    "requires": ["node"],
    "cli_support": ["claude", "gemini", "opencode"],
    "tags": ["filesystem", "files", "directories"],
    "github": "https://github.com/modelcontextprotocol/servers",
    "security": { "trust_level": "verified", "last_checked": "2026-04-03" }
  },
  {
    "id": "mcp-github",
    "name": "GitHub MCP",
    "type": "mcp",
    "category": ["git", "ci-cd"],
    "languages": [],
    "description": "Interact with GitHub — repos, issues, PRs, actions, and code search via MCP",
    "when_to_use": "Managing GitHub repos, creating PRs, searching code, viewing CI status",
    "install": { "command": "npx -y @modelcontextprotocol/server-github", "package_manager": "npm" },
    "run": { "command": "npx @modelcontextprotocol/server-github" },
    "risk_level": "medium",
    "requires": ["node", "GITHUB_TOKEN"],
    "cli_support": ["claude", "gemini", "opencode"],
    "tags": ["github", "git", "pr", "issues", "ci"],
    "github": "https://github.com/modelcontextprotocol/servers",
    "security": { "trust_level": "verified", "last_checked": "2026-04-03" }
  },
  {
    "id": "mcp-postgres",
    "name": "PostgreSQL MCP",
    "type": "mcp",
    "category": ["database"],
    "languages": [],
    "frameworks": ["postgresql"],
    "description": "Query and manage PostgreSQL databases through MCP",
    "when_to_use": "Database queries, schema inspection, data exploration",
    "install": { "command": "npx -y @modelcontextprotocol/server-postgres", "package_manager": "npm" },
    "run": { "command": "npx @modelcontextprotocol/server-postgres <connection_string>" },
    "risk_level": "high",
    "requires": ["node"],
    "cli_support": ["claude", "gemini", "opencode"],
    "tags": ["database", "sql", "postgres"],
    "github": "https://github.com/modelcontextprotocol/servers",
    "security": { "trust_level": "verified", "last_checked": "2026-04-03" }
  },
  {
    "id": "mcp-sqlite",
    "name": "SQLite MCP",
    "type": "mcp",
    "category": ["database"],
    "languages": [],
    "description": "Query and manage SQLite databases through MCP",
    "when_to_use": "Local database inspection, SQLite queries, data analysis",
    "install": { "command": "npx -y @modelcontextprotocol/server-sqlite", "package_manager": "npm" },
    "run": { "command": "npx @modelcontextprotocol/server-sqlite <db_path>" },
    "risk_level": "medium",
    "requires": ["node"],
    "cli_support": ["claude", "gemini", "opencode"],
    "tags": ["database", "sql", "sqlite"],
    "github": "https://github.com/modelcontextprotocol/servers",
    "security": { "trust_level": "verified", "last_checked": "2026-04-03" }
  },
  {
    "id": "mcp-puppeteer",
    "name": "Puppeteer MCP",
    "type": "mcp",
    "category": ["e2e", "test"],
    "languages": ["javascript", "typescript"],
    "description": "Browser automation through MCP — navigate, screenshot, interact with web pages",
    "when_to_use": "E2E testing, web scraping, visual regression, browser-based debugging",
    "install": { "command": "npx -y @modelcontextprotocol/server-puppeteer", "package_manager": "npm" },
    "run": { "command": "npx @modelcontextprotocol/server-puppeteer" },
    "risk_level": "medium",
    "requires": ["node", "chromium"],
    "cli_support": ["claude", "gemini", "opencode"],
    "tags": ["browser", "e2e", "testing", "automation", "screenshots"],
    "github": "https://github.com/modelcontextprotocol/servers",
    "security": { "trust_level": "verified", "last_checked": "2026-04-03" }
  },
  {
    "id": "mcp-brave-search",
    "name": "Brave Search MCP",
    "type": "mcp",
    "category": ["search"],
    "languages": [],
    "description": "Web and local search through the Brave Search API",
    "when_to_use": "Researching documentation, finding solutions, looking up API references",
    "install": { "command": "npx -y @modelcontextprotocol/server-brave-search", "package_manager": "npm" },
    "run": { "command": "npx @modelcontextprotocol/server-brave-search" },
    "risk_level": "low",
    "requires": ["node", "BRAVE_API_KEY"],
    "cli_support": ["claude", "gemini", "opencode"],
    "tags": ["search", "web", "research"],
    "github": "https://github.com/modelcontextprotocol/servers",
    "security": { "trust_level": "verified", "last_checked": "2026-04-03" }
  },
  {
    "id": "mcp-memory",
    "name": "Memory MCP",
    "type": "mcp",
    "category": ["memory"],
    "languages": [],
    "description": "Persistent memory for AI assistants using a knowledge graph",
    "when_to_use": "Maintaining context across sessions, storing user preferences and project facts",
    "install": { "command": "npx -y @modelcontextprotocol/server-memory", "package_manager": "npm" },
    "run": { "command": "npx @modelcontextprotocol/server-memory" },
    "risk_level": "low",
    "requires": ["node"],
    "cli_support": ["claude", "gemini", "opencode"],
    "tags": ["memory", "knowledge-graph", "persistence"],
    "github": "https://github.com/modelcontextprotocol/servers",
    "security": { "trust_level": "verified", "last_checked": "2026-04-03" }
  },
  {
    "id": "mcp-fetch",
    "name": "Fetch MCP",
    "type": "mcp",
    "category": ["web"],
    "languages": [],
    "description": "Fetch web content and convert to markdown for LLM consumption",
    "when_to_use": "Reading documentation, fetching API responses, scraping web content",
    "install": { "command": "npx -y @modelcontextprotocol/server-fetch", "package_manager": "npm" },
    "run": { "command": "npx @modelcontextprotocol/server-fetch" },
    "risk_level": "low",
    "requires": ["node"],
    "cli_support": ["claude", "gemini", "opencode"],
    "tags": ["web", "fetch", "http", "markdown"],
    "github": "https://github.com/modelcontextprotocol/servers",
    "security": { "trust_level": "verified", "last_checked": "2026-04-03" }
  }
]
