[
  {
    "id": "mdbook",
    "name": "mdBook",
    "type": "cli",
    "category": ["docs"],
    "languages": [],
    "description": "Rust-powered tool for creating books and documentation from Markdown files — used by the Rust Book, mdBook, and many open source projects",
    "when_to_use": "Creating structured documentation sites, technical books, and project guides from Markdown with search and theming",
    "install": { "command": "brew install mdbook || cargo install mdbook", "binary_name": "mdbook" },
    "run": { "command": "mdbook", "common_flags": ["init", "build", "serve", "serve --open", "test", "clean"] },
    "risk_level": "low",
    "requires": [],
    "cli_support": ["claude", "gemini", "opencode", "codex"],
    "tags": ["docs", "markdown", "book", "static-site", "rust"],
    "github": "https://github.com/rust-lang/mdBook",
    "security": { "trust_level": "verified", "last_checked": "2026-04-03" }
  },
  {
    "id": "hugo",
    "name": "Hugo",
    "type": "cli",
    "category": ["docs"],
    "languages": [],
    "description": "Fastest static site generator — builds documentation sites, blogs, and landing pages from Markdown and Go templates in milliseconds",
    "when_to_use": "Documentation sites, project websites, and blogs that need fast build times and rich theming with zero JavaScript dependencies",
    "install": { "command": "brew install hugo || go install github.com/gohugoio/hugo@latest", "binary_name": "hugo" },
    "run": { "command": "hugo", "common_flags": ["server", "new site <name>", "new content posts/my-post.md", "--minify", "--theme <name>", "--buildDrafts"] },
    "risk_level": "low",
    "requires": [],
    "cli_support": ["claude", "gemini", "opencode", "codex"],
    "tags": ["docs", "static-site", "blog", "fast", "go-templates"],
    "github": "https://github.com/gohugoio/hugo",
    "security": { "trust_level": "verified", "last_checked": "2026-04-03" }
  },
  {
    "id": "docusaurus",
    "name": "Docusaurus",
    "type": "cli",
    "category": ["docs"],
    "languages": ["javascript", "typescript"],
    "description": "React-based documentation framework by Meta — Markdown docs with versioning, i18n, search, and a plugin ecosystem",
    "when_to_use": "Documentation sites needing versioning, internationalization, blog integration, and React component embedding",
    "install": { "command": "npx create-docusaurus@latest my-docs classic", "binary_name": "docusaurus" },
    "run": { "command": "npx docusaurus", "common_flags": ["start", "build", "deploy", "swizzle", "clear", "write-translations"] },
    "risk_level": "low",
    "requires": ["node"],
    "cli_support": ["claude", "gemini", "opencode", "codex"],
    "tags": ["docs", "react", "versioning", "i18n", "meta"],
    "github": "https://github.com/facebook/docusaurus",
    "security": { "trust_level": "verified", "last_checked": "2026-04-03" }
  },
  {
    "id": "asciidoctor",
    "name": "Asciidoctor",
    "type": "cli",
    "category": ["docs"],
    "languages": [],
    "description": "AsciiDoc processor and publishing toolchain — converts AsciiDoc to HTML, PDF, EPUB, and man pages with rich formatting beyond Markdown",
    "when_to_use": "Technical documentation requiring tables, admonitions, cross-references, and multi-format output that Markdown cannot handle well",
    "install": { "command": "brew install asciidoctor || gem install asciidoctor", "binary_name": "asciidoctor" },
    "run": { "command": "asciidoctor", "common_flags": ["doc.adoc", "-b html5", "-b pdf (requires asciidoctor-pdf)", "-D output/", "-a toc=left", "-a source-highlighter=rouge"] },
    "risk_level": "low",
    "requires": [],
    "cli_support": ["claude", "gemini", "opencode", "codex"],
    "tags": ["docs", "asciidoc", "pdf", "epub", "technical-writing"],
    "github": "https://github.com/asciidoctor/asciidoctor",
    "security": { "trust_level": "verified", "last_checked": "2026-04-03" }
  },
  {
    "id": "pandoc",
    "name": "Pandoc",
    "type": "cli",
    "category": ["docs"],
    "languages": [],
    "description": "Universal document converter — converts between Markdown, HTML, LaTeX, DOCX, PDF, EPUB, reStructuredText, and dozens more formats",
    "when_to_use": "Converting between document formats, generating PDFs from Markdown, creating DOCX reports from templates, multi-format publishing",
    "install": { "command": "brew install pandoc || sudo apt install pandoc", "binary_name": "pandoc" },
    "run": { "command": "pandoc", "common_flags": ["-f markdown -t html", "-o output.pdf", "-o output.docx", "--template <file>", "--toc", "--standalone", "--metadata title='My Doc'"] },
    "risk_level": "low",
    "requires": [],
    "cli_support": ["claude", "gemini", "opencode", "codex"],
    "tags": ["docs", "converter", "markdown", "pdf", "multi-format"],
    "github": "https://github.com/jgm/pandoc",
    "security": { "trust_level": "verified", "last_checked": "2026-04-03" }
  }
]
