[
  {
    "id": "act",
    "name": "act",
    "type": "cli",
    "category": ["ci-cd", "automation"],
    "languages": [],
    "description": "Run GitHub Actions workflows locally using Docker — test CI pipelines without pushing to GitHub, with fast feedback loops",
    "when_to_use": "Testing and debugging GitHub Actions workflows locally before pushing, iterating on CI configuration",
    "install": { "command": "brew install act || go install github.com/nektos/act@latest", "binary_name": "act" },
    "run": { "command": "act", "common_flags": ["-j <job_name>", "-W .github/workflows/<file>", "--list", "-n (dry run)", "-s GITHUB_TOKEN=<token>", "--container-architecture linux/amd64"] },
    "risk_level": "medium",
    "requires": ["docker"],
    "cli_support": ["claude", "gemini", "opencode", "codex"],
    "tags": ["ci", "github-actions", "local", "docker", "testing"],
    "github": "https://github.com/nektos/act",
    "security": { "trust_level": "verified", "last_checked": "2026-04-03" }
  },
  {
    "id": "gh-cli",
    "name": "GitHub CLI",
    "type": "cli",
    "category": ["ci-cd", "git"],
    "languages": [],
    "description": "Official GitHub CLI — create PRs, manage issues, trigger workflows, review checks, and interact with GitHub APIs from the terminal",
    "when_to_use": "Creating pull requests, managing issues, triggering CI workflows, checking run status, managing releases",
    "install": { "command": "brew install gh || winget install GitHub.cli", "binary_name": "gh" },
    "run": { "command": "gh", "common_flags": ["pr create", "pr list", "pr merge", "issue create", "run list", "run watch", "release create", "api <endpoint>"] },
    "risk_level": "medium",
    "requires": [],
    "cli_support": ["claude", "gemini", "opencode", "codex"],
    "tags": ["github", "pr", "issues", "ci", "releases", "api"],
    "github": "https://github.com/cli/cli",
    "security": { "trust_level": "verified", "last_checked": "2026-04-03" }
  },
  {
    "id": "git-cliff",
    "name": "git-cliff",
    "type": "cli",
    "category": ["ci-cd", "automation"],
    "languages": [],
    "description": "Generate changelogs from git history using conventional commits — customizable templates with keep-a-changelog and custom formats",
    "when_to_use": "Before releases, automating CHANGELOG.md generation, enforcing changelog consistency in CI",
    "install": { "command": "brew install git-cliff || cargo install git-cliff", "binary_name": "git-cliff" },
    "run": { "command": "git-cliff", "common_flags": ["-o CHANGELOG.md", "--tag <version>", "--unreleased", "--latest", "--bump", "--config cliff.toml"] },
    "risk_level": "low",
    "requires": ["git"],
    "cli_support": ["claude", "gemini", "opencode", "codex"],
    "tags": ["changelog", "release", "conventional-commits", "git"],
    "github": "https://github.com/orhun/git-cliff",
    "security": { "trust_level": "verified", "last_checked": "2026-04-03" }
  },
  {
    "id": "conventional-commits",
    "name": "commitlint",
    "type": "cli",
    "category": ["ci-cd", "git"],
    "languages": [],
    "description": "Lint commit messages against conventional commit format — enforces structured commit history for automated changelog generation and semantic versioning",
    "when_to_use": "As a git hook or CI check to enforce conventional commit messages across the team",
    "what_it_finds": "Non-conforming commit messages, missing type prefix, incorrect format",
    "install": { "command": "npm install -D @commitlint/cli @commitlint/config-conventional", "package_manager": "npm", "binary_name": "npx" },
    "run": { "command": "npx commitlint", "common_flags": ["--from HEAD~1", "--edit", "--config commitlint.config.js", "--verbose"] },
    "risk_level": "low",
    "requires": ["node"],
    "cli_support": ["claude", "gemini", "opencode", "codex"],
    "tags": ["git", "commit", "conventional-commits", "lint", "hooks"],
    "github": "https://github.com/conventional-changelog/commitlint",
    "security": { "trust_level": "verified", "last_checked": "2026-04-03" }
  },
  {
    "id": "docker-build",
    "name": "docker build",
    "type": "cli",
    "category": ["ci-cd", "deploy"],
    "languages": [],
    "description": "Build container images from a Dockerfile — package applications with dependencies for consistent deployment across environments",
    "when_to_use": "Building container images for deployment, creating reproducible build artifacts, CI image pipelines",
    "install": { "command": "brew install --cask docker || curl -fsSL https://get.docker.com | sh", "binary_name": "docker" },
    "run": { "command": "docker build", "common_flags": ["-t <image>:<tag>", "-f <Dockerfile>", "--target <stage>", "--build-arg <key>=<value>", "--no-cache", "--platform linux/amd64", "."] },
    "risk_level": "medium",
    "requires": ["docker"],
    "cli_support": ["claude", "gemini", "opencode", "codex"],
    "tags": ["docker", "container", "build", "deploy", "image"],
    "github": "https://github.com/moby/moby",
    "security": { "trust_level": "verified", "last_checked": "2026-04-03" }
  },
  {
    "id": "docker-compose",
    "name": "docker compose",
    "type": "cli",
    "category": ["ci-cd", "deploy"],
    "languages": [],
    "description": "Define and run multi-container applications — orchestrate services, networks, and volumes from a declarative YAML file",
    "when_to_use": "Running multi-service stacks locally, integration testing with real dependencies, development environments",
    "install": { "command": "Included with Docker Desktop or install docker-compose-plugin", "binary_name": "docker" },
    "run": { "command": "docker compose", "common_flags": ["up -d", "down", "build", "logs -f", "ps", "-f <file>", "--profile <profile>", "exec <service> <cmd>"] },
    "risk_level": "medium",
    "requires": ["docker"],
    "cli_support": ["claude", "gemini", "opencode", "codex"],
    "tags": ["docker", "container", "orchestration", "multi-service", "development"],
    "github": "https://github.com/docker/compose",
    "security": { "trust_level": "verified", "last_checked": "2026-04-03" }
  },
  {
    "id": "just",
    "name": "just",
    "type": "cli",
    "category": ["ci-cd", "automation"],
    "languages": [],
    "description": "Command runner similar to make but focused on running project-specific commands — no build system complexity, just recipes in a justfile",
    "when_to_use": "Defining project commands (build, test, lint, deploy), replacing Makefiles for task running without build graph overhead",
    "install": { "command": "brew install just || cargo install just", "binary_name": "just" },
    "run": { "command": "just", "common_flags": ["<recipe>", "--list", "--dry-run", "--set <var> <value>", "-f <justfile>", "--choose"] },
    "risk_level": "low",
    "requires": [],
    "cli_support": ["claude", "gemini", "opencode", "codex"],
    "tags": ["task-runner", "automation", "commands", "justfile"],
    "github": "https://github.com/casey/just",
    "security": { "trust_level": "verified", "last_checked": "2026-04-03" }
  },
  {
    "id": "make",
    "name": "GNU Make",
    "type": "cli",
    "category": ["ci-cd", "automation"],
    "languages": [],
    "description": "Classic build automation tool — define targets with dependencies in a Makefile for reproducible project workflows",
    "when_to_use": "Standard project automation, defining build/test/deploy targets, when a Makefile already exists",
    "install": { "command": "Pre-installed on most Unix systems || brew install make || apt install make", "binary_name": "make" },
    "run": { "command": "make", "common_flags": ["<target>", "-j$(nproc)", "-f <Makefile>", "-n (dry run)", "-B (force)", "VARIABLE=value"] },
    "risk_level": "medium",
    "requires": [],
    "cli_support": ["claude", "gemini", "opencode", "codex"],
    "tags": ["build", "automation", "task-runner", "makefile", "classic"],
    "github": "https://savannah.gnu.org/projects/make",
    "security": { "trust_level": "verified", "last_checked": "2026-04-03" }
  }
]
