[
  {
    "id": "aws-cli",
    "name": "AWS CLI",
    "type": "cli",
    "category": ["cloud"],
    "languages": [],
    "description": "Official command-line interface for Amazon Web Services — manage EC2, S3, Lambda, ECS, and 200+ AWS services from the terminal",
    "when_to_use": "Managing AWS resources, deploying to AWS, scripting cloud operations, configuring IAM and networking",
    "install": { "command": "brew install awscli || curl 'https://awscli.amazonaws.com/awscli-exe-linux-x86_64.zip' -o awscli.zip && unzip awscli.zip && sudo ./aws/install", "binary_name": "aws" },
    "run": { "command": "aws", "common_flags": ["s3 ls", "ec2 describe-instances", "lambda invoke", "sts get-caller-identity", "--region us-east-1", "--output json", "--profile <name>"] },
    "risk_level": "high",
    "requires": [],
    "cli_support": ["claude", "gemini", "opencode", "codex"],
    "tags": ["cloud", "aws", "infrastructure", "deploy", "s3", "lambda"],
    "github": "https://github.com/aws/aws-cli",
    "security": { "trust_level": "verified", "last_checked": "2026-04-03" }
  },
  {
    "id": "gcloud",
    "name": "Google Cloud CLI",
    "type": "cli",
    "category": ["cloud"],
    "languages": [],
    "description": "Official CLI for Google Cloud Platform — manage Compute Engine, Cloud Run, GKE, BigQuery, and all GCP services",
    "when_to_use": "Managing GCP resources, deploying to Cloud Run or GKE, managing IAM, querying BigQuery",
    "install": { "command": "brew install --cask google-cloud-sdk || curl https://sdk.cloud.google.com | bash", "binary_name": "gcloud" },
    "run": { "command": "gcloud", "common_flags": ["compute instances list", "run deploy", "container clusters list", "auth login", "config set project <id>", "--format json"] },
    "risk_level": "high",
    "requires": [],
    "cli_support": ["claude", "gemini", "opencode", "codex"],
    "tags": ["cloud", "gcp", "infrastructure", "deploy", "kubernetes"],
    "github": "https://github.com/googleapis/google-cloud-go",
    "security": { "trust_level": "verified", "last_checked": "2026-04-03" }
  },
  {
    "id": "az-cli",
    "name": "Azure CLI",
    "type": "cli",
    "category": ["cloud"],
    "languages": [],
    "description": "Official CLI for Microsoft Azure — manage VMs, App Service, AKS, Azure Functions, and all Azure services from the terminal",
    "when_to_use": "Managing Azure resources, deploying to Azure App Service or AKS, configuring Azure AD and networking",
    "install": { "command": "brew install azure-cli || curl -sL https://aka.ms/InstallAzureCLIDeb | sudo bash", "binary_name": "az" },
    "run": { "command": "az", "common_flags": ["login", "group list", "vm list", "webapp deploy", "aks get-credentials", "--output json", "--subscription <id>"] },
    "risk_level": "high",
    "requires": [],
    "cli_support": ["claude", "gemini", "opencode", "codex"],
    "tags": ["cloud", "azure", "infrastructure", "deploy", "kubernetes"],
    "github": "https://github.com/Azure/azure-cli",
    "security": { "trust_level": "verified", "last_checked": "2026-04-03" }
  },
  {
    "id": "terraform",
    "name": "Terraform",
    "type": "cli",
    "category": ["cloud"],
    "languages": [],
    "description": "Infrastructure as Code tool by HashiCorp — define cloud resources in HCL, plan changes, and apply them across any cloud provider",
    "when_to_use": "Provisioning and managing cloud infrastructure declaratively, multi-cloud deployments, infrastructure drift detection",
    "install": { "command": "brew install terraform || curl -fsSL https://releases.hashicorp.com/terraform/1.x/terraform_1.x_linux_amd64.zip -o tf.zip && unzip tf.zip", "binary_name": "terraform" },
    "run": { "command": "terraform", "common_flags": ["init", "plan", "apply", "destroy", "fmt", "validate", "state list", "-auto-approve", "-var 'key=value'"] },
    "risk_level": "high",
    "requires": [],
    "cli_support": ["claude", "gemini", "opencode", "codex"],
    "tags": ["cloud", "iac", "infrastructure", "multi-cloud", "hcl"],
    "github": "https://github.com/hashicorp/terraform",
    "security": { "trust_level": "verified", "last_checked": "2026-04-03" }
  },
  {
    "id": "pulumi",
    "name": "Pulumi",
    "type": "cli",
    "category": ["cloud"],
    "languages": ["typescript", "python", "go", "java", "csharp"],
    "description": "Infrastructure as Code using real programming languages — define cloud resources in TypeScript, Python, Go, or Java instead of DSLs",
    "when_to_use": "IaC with familiar programming languages, when you need loops/conditionals/abstractions that HCL makes difficult",
    "install": { "command": "brew install pulumi || curl -fsSL https://get.pulumi.com | sh", "binary_name": "pulumi" },
    "run": { "command": "pulumi", "common_flags": ["up", "preview", "destroy", "stack ls", "config set <key> <value>", "new <template>", "--yes", "--stack <name>"] },
    "risk_level": "high",
    "requires": [],
    "cli_support": ["claude", "gemini", "opencode", "codex"],
    "tags": ["cloud", "iac", "infrastructure", "multi-cloud", "code-first"],
    "github": "https://github.com/pulumi/pulumi",
    "security": { "trust_level": "verified", "last_checked": "2026-04-03" }
  },
  {
    "id": "kubectl",
    "name": "kubectl",
    "type": "cli",
    "category": ["cloud"],
    "languages": [],
    "description": "Kubernetes command-line tool — manage clusters, deploy applications, inspect resources, and debug pods across any Kubernetes environment",
    "when_to_use": "Managing Kubernetes clusters, deploying and scaling applications, debugging pods, inspecting cluster state",
    "install": { "command": "brew install kubectl || curl -LO 'https://dl.k8s.io/release/$(curl -sL https://dl.k8s.io/release/stable.txt)/bin/linux/amd64/kubectl'", "binary_name": "kubectl" },
    "run": { "command": "kubectl", "common_flags": ["get pods", "apply -f <file>", "logs <pod>", "exec -it <pod> -- /bin/sh", "describe <resource>", "port-forward", "-n <namespace>", "--context <ctx>"] },
    "risk_level": "high",
    "requires": [],
    "cli_support": ["claude", "gemini", "opencode", "codex"],
    "tags": ["cloud", "kubernetes", "containers", "orchestration", "deploy"],
    "github": "https://github.com/kubernetes/kubectl",
    "security": { "trust_level": "verified", "last_checked": "2026-04-03" }
  },
  {
    "id": "helm",
    "name": "Helm",
    "type": "cli",
    "category": ["cloud"],
    "languages": [],
    "description": "Kubernetes package manager — install, upgrade, and manage applications on Kubernetes using reusable chart templates",
    "when_to_use": "Deploying complex applications to Kubernetes, managing release versions, using community charts for common services",
    "install": { "command": "brew install helm || curl https://raw.githubusercontent.com/helm/helm/main/scripts/get-helm-3 | bash", "binary_name": "helm" },
    "run": { "command": "helm", "common_flags": ["install <name> <chart>", "upgrade <name> <chart>", "list", "repo add <name> <url>", "template <chart>", "uninstall <name>", "--values values.yaml"] },
    "risk_level": "high",
    "requires": ["kubectl"],
    "cli_support": ["claude", "gemini", "opencode", "codex"],
    "tags": ["cloud", "kubernetes", "package-manager", "charts", "deploy"],
    "github": "https://github.com/helm/helm",
    "security": { "trust_level": "verified", "last_checked": "2026-04-03" }
  },
  {
    "id": "kustomize",
    "name": "Kustomize",
    "type": "cli",
    "category": ["cloud"],
    "languages": [],
    "description": "Kubernetes configuration customization tool — overlay-based approach to managing environment-specific YAML without templates",
    "when_to_use": "Managing Kubernetes manifests across environments (dev/staging/prod) without templating, patching base configs with overlays",
    "install": { "command": "brew install kustomize || curl -s 'https://raw.githubusercontent.com/kubernetes-sigs/kustomize/master/hack/install_kustomize.sh' | bash", "binary_name": "kustomize" },
    "run": { "command": "kustomize", "common_flags": ["build <dir>", "build <dir> | kubectl apply -f -", "edit add resource <file>", "edit set image <img>=<new>", "edit set namespace <ns>"] },
    "risk_level": "medium",
    "requires": ["kubectl"],
    "cli_support": ["claude", "gemini", "opencode", "codex"],
    "tags": ["cloud", "kubernetes", "configuration", "overlays", "yaml"],
    "github": "https://github.com/kubernetes-sigs/kustomize",
    "security": { "trust_level": "verified", "last_checked": "2026-04-03" }
  }
]
