[
  {
    "id": "kotlinc",
    "name": "Kotlin compiler",
    "type": "cli",
    "category": ["build"],
    "languages": ["kotlin"],
    "description": "The official Kotlin command-line compiler — compiles .kt sources to JVM bytecode, JS, or native binaries",
    "when_to_use": "Base dependency for any Kotlin project; usually invoked via Gradle rather than directly",
    "install": { "command": "sdk install kotlin", "binary_name": "kotlinc" },
    "run": { "command": "kotlinc", "common_flags": ["-include-runtime", "-d out.jar"] },
    "risk_level": "low",
    "cli_support": ["claude", "gemini", "opencode", "codex"],
    "tags": ["compiler", "kotlin"],
    "github": "https://github.com/JetBrains/kotlin",
    "security": { "trust_level": "verified", "last_checked": "2026-04-03" }
  },
  {
    "id": "ktlint",
    "name": "ktlint",
    "type": "cli",
    "category": ["lint", "format"],
    "languages": ["kotlin"],
    "description": "Anti-bikeshedding Kotlin linter with built-in formatter — enforces the official Kotlin coding conventions",
    "when_to_use": "Any Kotlin project that wants automated style enforcement and formatting without configuration overhead",
    "install": { "command": "brew install ktlint", "binary_name": "ktlint" },
    "run": { "command": "ktlint", "common_flags": ["-F", "--reporter=checkstyle"] },
    "risk_level": "low",
    "cli_support": ["claude", "gemini", "opencode", "codex"],
    "tags": ["lint", "format", "style"],
    "github": "https://github.com/pinterest/ktlint",
    "security": { "trust_level": "verified", "last_checked": "2026-04-03" }
  },
  {
    "id": "detekt",
    "name": "detekt",
    "type": "cli",
    "category": ["lint"],
    "languages": ["kotlin"],
    "description": "Static code analyzer for Kotlin focused on code smells, complexity, and maintainability",
    "when_to_use": "Production Kotlin codebases that need deeper quality gates than ktlint",
    "install": { "command": "brew install detekt", "binary_name": "detekt" },
    "run": { "command": "detekt", "common_flags": ["--input src/main/kotlin"] },
    "risk_level": "low",
    "cli_support": ["claude", "gemini", "opencode", "codex"],
    "tags": ["lint", "static-analysis"],
    "github": "https://github.com/detekt/detekt",
    "security": { "trust_level": "verified", "last_checked": "2026-04-03" }
  },
  {
    "id": "gradle",
    "name": "Gradle",
    "type": "cli",
    "category": ["build"],
    "languages": ["kotlin", "java"],
    "description": "The canonical build tool for Kotlin (and modern Java) projects — Kotlin DSL support, incremental builds, rich plugin ecosystem",
    "when_to_use": "Every non-trivial Kotlin or Android project; gradle wrapper is standard",
    "install": { "command": "sdk install gradle", "binary_name": "gradle" },
    "run": { "command": "./gradlew", "common_flags": ["build", "test", "check", "clean", "assemble"] },
    "risk_level": "medium",
    "cli_support": ["claude", "gemini", "opencode", "codex"],
    "tags": ["build", "gradle"],
    "github": "https://github.com/gradle/gradle",
    "security": { "trust_level": "verified", "last_checked": "2026-04-03" }
  },
  {
    "id": "dokka",
    "name": "Dokka",
    "type": "cli",
    "category": ["docs"],
    "languages": ["kotlin"],
    "description": "API documentation engine for Kotlin — the Kotlin equivalent of javadoc with support for mixed Kotlin/Java projects",
    "when_to_use": "For Kotlin libraries that need published API reference docs",
    "install": { "command": "Add dokka Gradle plugin" },
    "run": { "command": "./gradlew dokkaHtml" },
    "risk_level": "low",
    "cli_support": ["claude", "gemini", "opencode", "codex"],
    "tags": ["docs", "api-reference"],
    "github": "https://github.com/Kotlin/dokka",
    "security": { "trust_level": "verified", "last_checked": "2026-04-03" }
  },
  {
    "id": "kotest",
    "name": "Kotest",
    "type": "library",
    "category": ["test"],
    "languages": ["kotlin"],
    "description": "Powerful Kotlin testing framework with multiple style DSLs, property-based testing, and data-driven tests",
    "when_to_use": "When you want a more Kotlin-idiomatic testing experience than JUnit",
    "install": { "command": "Add io.kotest dependencies to Gradle" },
    "run": { "command": "./gradlew test" },
    "risk_level": "low",
    "cli_support": ["claude", "gemini", "opencode", "codex"],
    "tags": ["test", "property-based"],
    "github": "https://github.com/kotest/kotest",
    "security": { "trust_level": "verified", "last_checked": "2026-04-03" }
  },
  {
    "id": "kotlinx-coroutines",
    "name": "kotlinx.coroutines",
    "type": "library",
    "category": ["automation"],
    "languages": ["kotlin"],
    "description": "Official Kotlin coroutines library for structured concurrency — flows, channels, supervisor scopes",
    "when_to_use": "Any Kotlin async code; default choice over threads or callbacks",
    "install": { "command": "Add org.jetbrains.kotlinx:kotlinx-coroutines-core dependency" },
    "run": { "command": "./gradlew run" },
    "risk_level": "low",
    "cli_support": ["claude", "gemini", "opencode", "codex"],
    "tags": ["concurrency", "async", "coroutines"],
    "github": "https://github.com/Kotlin/kotlinx.coroutines",
    "security": { "trust_level": "verified", "last_checked": "2026-04-03" }
  }
]
