[
  {
    "id": "pgcli",
    "name": "pgcli",
    "type": "cli",
    "category": ["database"],
    "languages": [],
    "description": "PostgreSQL CLI with auto-completion and syntax highlighting — interactive psql replacement with smart completions for tables, columns, and functions",
    "when_to_use": "Interactive PostgreSQL querying, exploring schemas, running ad-hoc queries with better ergonomics than psql",
    "install": { "command": "pip install pgcli || brew install pgcli", "binary_name": "pgcli" },
    "run": { "command": "pgcli", "common_flags": ["postgresql://user:pass@host/db", "-h localhost", "-U postgres", "-d mydb", "--auto-vertical-output"] },
    "risk_level": "medium",
    "requires": [],
    "cli_support": ["claude", "gemini", "opencode", "codex"],
    "tags": ["database", "postgresql", "interactive", "auto-complete"],
    "github": "https://github.com/dbcli/pgcli",
    "security": { "trust_level": "verified", "last_checked": "2026-04-03" }
  },
  {
    "id": "mycli",
    "name": "mycli",
    "type": "cli",
    "category": ["database"],
    "languages": [],
    "description": "MySQL/MariaDB CLI with auto-completion and syntax highlighting — interactive mysql replacement with smart completions",
    "when_to_use": "Interactive MySQL/MariaDB querying with better ergonomics than the default mysql client",
    "install": { "command": "pip install mycli || brew install mycli", "binary_name": "mycli" },
    "run": { "command": "mycli", "common_flags": ["-h localhost", "-u root", "-D mydb", "mysql://user:pass@host/db", "--auto-vertical-output"] },
    "risk_level": "medium",
    "requires": [],
    "cli_support": ["claude", "gemini", "opencode", "codex"],
    "tags": ["database", "mysql", "mariadb", "interactive", "auto-complete"],
    "github": "https://github.com/dbcli/mycli",
    "security": { "trust_level": "verified", "last_checked": "2026-04-03" }
  },
  {
    "id": "litecli",
    "name": "litecli",
    "type": "cli",
    "category": ["database"],
    "languages": [],
    "description": "SQLite CLI with auto-completion and syntax highlighting — interactive sqlite3 replacement with smart completions for tables and columns",
    "when_to_use": "Interactive SQLite querying and schema exploration with better ergonomics than sqlite3",
    "install": { "command": "pip install litecli || brew install litecli", "binary_name": "litecli" },
    "run": { "command": "litecli", "common_flags": ["mydb.sqlite", "--auto-vertical-output", "-e 'SELECT * FROM users'"] },
    "risk_level": "low",
    "requires": [],
    "cli_support": ["claude", "gemini", "opencode", "codex"],
    "tags": ["database", "sqlite", "interactive", "auto-complete"],
    "github": "https://github.com/dbcli/litecli",
    "security": { "trust_level": "verified", "last_checked": "2026-04-03" }
  },
  {
    "id": "dbmate",
    "name": "dbmate",
    "type": "cli",
    "category": ["database"],
    "languages": [],
    "description": "Lightweight database migration tool — framework-agnostic SQL migrations for PostgreSQL, MySQL, SQLite, and ClickHouse",
    "when_to_use": "Managing database schema migrations in any project without ORM dependencies — pure SQL migration files",
    "install": { "command": "brew install dbmate || curl -fsSL -o /usr/local/bin/dbmate https://github.com/amacneil/dbmate/releases/latest/download/dbmate-linux-amd64 && chmod +x /usr/local/bin/dbmate", "binary_name": "dbmate" },
    "run": { "command": "dbmate", "common_flags": ["new <name>", "up", "down", "migrate", "rollback", "status", "--url 'postgres://user:pass@host/db'"] },
    "risk_level": "high",
    "requires": [],
    "cli_support": ["claude", "gemini", "opencode", "codex"],
    "tags": ["database", "migrations", "sql", "schema", "multi-database"],
    "github": "https://github.com/amacneil/dbmate",
    "security": { "trust_level": "verified", "last_checked": "2026-04-03" }
  },
  {
    "id": "atlas",
    "name": "Atlas",
    "type": "cli",
    "category": ["database"],
    "languages": [],
    "description": "Modern database schema management tool — declarative migrations with schema diffing, linting, and drift detection for PostgreSQL, MySQL, SQLite, and more",
    "when_to_use": "Declarative schema management, automatic migration generation from schema diffs, schema linting and CI integration",
    "install": { "command": "brew install ariga/tap/atlas || curl -sSfL https://atlasgo.sh | sh", "binary_name": "atlas" },
    "run": { "command": "atlas", "common_flags": ["schema inspect -u <url>", "schema diff", "schema apply -u <url>", "migrate diff --dev-url <url>", "migrate apply -u <url>", "migrate lint"] },
    "risk_level": "high",
    "requires": [],
    "cli_support": ["claude", "gemini", "opencode", "codex"],
    "tags": ["database", "migrations", "schema", "declarative", "drift-detection"],
    "github": "https://github.com/ariga/atlas",
    "security": { "trust_level": "verified", "last_checked": "2026-04-03" }
  },
  {
    "id": "sqitch",
    "name": "Sqitch",
    "type": "cli",
    "category": ["database"],
    "languages": [],
    "description": "Database change management system — dependency-aware migrations without ORM, using native SQL scripts and a plan file",
    "when_to_use": "Complex database migration workflows requiring dependency ordering, revert capabilities, and cross-database support",
    "install": { "command": "brew install sqitch || cpanm App::Sqitch", "binary_name": "sqitch" },
    "run": { "command": "sqitch", "common_flags": ["add <change>", "deploy", "revert", "verify", "status", "log", "--target db:pg://user@host/db"] },
    "risk_level": "high",
    "requires": [],
    "cli_support": ["claude", "gemini", "opencode", "codex"],
    "tags": ["database", "migrations", "change-management", "dependency-aware", "native-sql"],
    "github": "https://github.com/sqitchers/sqitch",
    "security": { "trust_level": "verified", "last_checked": "2026-04-03" }
  },
  {
    "id": "flyway",
    "name": "Flyway",
    "type": "cli",
    "category": ["database"],
    "languages": ["java"],
    "description": "Version-controlled database migration tool — convention-based SQL and Java migrations with baseline support for existing databases",
    "when_to_use": "JVM-based projects needing database version control, or any project wanting mature, battle-tested SQL migrations",
    "install": { "command": "brew install flyway || curl -sL https://repo1.maven.org/maven2/org/flywaydb/flyway-commandline/10.0.0/flyway-commandline-10.0.0-linux-x64.tar.gz | tar xz", "binary_name": "flyway" },
    "run": { "command": "flyway", "common_flags": ["migrate", "info", "validate", "repair", "baseline", "clean", "-url=jdbc:postgresql://host/db", "-user=<user>"] },
    "risk_level": "high",
    "requires": ["java"],
    "cli_support": ["claude", "gemini", "opencode", "codex"],
    "tags": ["database", "migrations", "java", "sql", "version-control"],
    "github": "https://github.com/flyway/flyway",
    "security": { "trust_level": "verified", "last_checked": "2026-04-03" }
  },
  {
    "id": "liquibase",
    "name": "Liquibase",
    "type": "cli",
    "category": ["database"],
    "languages": ["java"],
    "description": "Database schema change management — tracks, versions, and deploys database changes using XML, YAML, JSON, or SQL changelogs",
    "when_to_use": "Enterprise database migration management, multi-format changelog support, rollback capabilities, and pre-deploy validation",
    "install": { "command": "brew install liquibase || curl -L https://github.com/liquibase/liquibase/releases/latest/download/liquibase-4.x.tar.gz | tar xz", "binary_name": "liquibase" },
    "run": { "command": "liquibase", "common_flags": ["update", "rollback --count 1", "status", "diff", "validate", "--changelog-file=changelog.xml", "--url=jdbc:postgresql://host/db"] },
    "risk_level": "high",
    "requires": ["java"],
    "cli_support": ["claude", "gemini", "opencode", "codex"],
    "tags": ["database", "migrations", "changelog", "enterprise", "rollback"],
    "github": "https://github.com/liquibase/liquibase",
    "security": { "trust_level": "verified", "last_checked": "2026-04-03" }
  }
]
