[
  {
    "id": "cmake",
    "name": "CMake",
    "type": "cli",
    "category": ["build"],
    "languages": ["c", "cpp"],
    "description": "Cross-platform build system generator — produces Makefiles, Ninja files, Visual Studio projects, and more from a single CMakeLists.txt",
    "when_to_use": "The standard build system for most modern C and C++ projects",
    "install": { "command": "brew install cmake", "binary_name": "cmake" },
    "run": { "command": "cmake", "common_flags": ["-S . -B build", "--build build", "--install build"] },
    "risk_level": "low",
    "cli_support": ["claude", "gemini", "opencode", "codex"],
    "tags": ["build", "cross-platform"],
    "github": "https://github.com/Kitware/CMake",
    "security": { "trust_level": "verified", "last_checked": "2026-04-03" }
  },
  {
    "id": "ninja",
    "name": "Ninja",
    "type": "cli",
    "category": ["build"],
    "languages": ["c", "cpp"],
    "description": "Small, fast build system focused on speed — usually generated from CMake and consumed as the low-level backend",
    "when_to_use": "Faster alternative to make; most CMake projects should target Ninja",
    "install": { "command": "brew install ninja", "binary_name": "ninja" },
    "run": { "command": "ninja", "common_flags": ["-C build", "-j$(nproc)"] },
    "risk_level": "low",
    "cli_support": ["claude", "gemini", "opencode", "codex"],
    "tags": ["build"],
    "github": "https://github.com/ninja-build/ninja",
    "security": { "trust_level": "verified", "last_checked": "2026-04-03" }
  },
  {
    "id": "meson",
    "name": "Meson",
    "type": "cli",
    "category": ["build"],
    "languages": ["c", "cpp"],
    "description": "Modern build system designed for speed and ease of use — often used as a CMake alternative in GNOME and systemd",
    "when_to_use": "C/C++ projects that want better ergonomics than raw CMake",
    "install": { "command": "pip install meson", "binary_name": "meson" },
    "run": { "command": "meson", "common_flags": ["setup build", "compile -C build", "test -C build"] },
    "risk_level": "low",
    "cli_support": ["claude", "gemini", "opencode", "codex"],
    "tags": ["build"],
    "github": "https://github.com/mesonbuild/meson",
    "security": { "trust_level": "verified", "last_checked": "2026-04-03" }
  },
  {
    "id": "clang-format",
    "name": "clang-format",
    "type": "cli",
    "category": ["format"],
    "languages": ["c", "cpp"],
    "description": "LLVM project's code formatter for C, C++, Objective-C, and more — highly configurable via .clang-format",
    "when_to_use": "Any C/C++ project that wants automated formatting; preset styles match Google, LLVM, Mozilla, WebKit",
    "install": { "command": "brew install clang-format", "binary_name": "clang-format" },
    "run": { "command": "clang-format", "common_flags": ["-i src/*.cpp", "--style=Google"] },
    "risk_level": "low",
    "cli_support": ["claude", "gemini", "opencode", "codex"],
    "tags": ["format", "llvm"],
    "github": "https://github.com/llvm/llvm-project",
    "security": { "trust_level": "verified", "last_checked": "2026-04-03" }
  },
  {
    "id": "clang-tidy",
    "name": "clang-tidy",
    "type": "cli",
    "category": ["lint"],
    "languages": ["c", "cpp"],
    "description": "Extensible C++ linting tool from LLVM — catches bugs, style issues, and suggests modernization refactors",
    "when_to_use": "Any serious C/C++ project for static analysis and automated code modernization",
    "install": { "command": "brew install llvm", "binary_name": "clang-tidy" },
    "run": { "command": "clang-tidy", "common_flags": ["src/*.cpp", "--fix"] },
    "risk_level": "low",
    "cli_support": ["claude", "gemini", "opencode", "codex"],
    "tags": ["lint", "static-analysis", "llvm"],
    "github": "https://github.com/llvm/llvm-project",
    "security": { "trust_level": "verified", "last_checked": "2026-04-03" }
  },
  {
    "id": "cppcheck",
    "name": "Cppcheck",
    "type": "cli",
    "category": ["lint"],
    "languages": ["c", "cpp"],
    "description": "Static analysis tool for C/C++ code focused on low false-positive detection of bugs and undefined behaviour",
    "when_to_use": "Complementary to clang-tidy; especially good at finding memory leaks and null-pointer issues",
    "install": { "command": "brew install cppcheck", "binary_name": "cppcheck" },
    "run": { "command": "cppcheck", "common_flags": ["--enable=all", "--suppress=missingIncludeSystem", "src/"] },
    "risk_level": "low",
    "cli_support": ["claude", "gemini", "opencode", "codex"],
    "tags": ["lint", "static-analysis"],
    "github": "https://github.com/danmar/cppcheck",
    "security": { "trust_level": "verified", "last_checked": "2026-04-03" }
  },
  {
    "id": "valgrind",
    "name": "Valgrind",
    "type": "cli",
    "category": ["monitoring", "qa"],
    "languages": ["c", "cpp"],
    "description": "Instrumentation framework for memory debugging, memory leak detection, and profiling — Memcheck, Helgrind, Callgrind",
    "when_to_use": "Finding memory bugs and leaks in C/C++ programs; requires Linux/macOS",
    "install": { "command": "sudo apt install valgrind", "binary_name": "valgrind" },
    "run": { "command": "valgrind", "common_flags": ["--leak-check=full", "--track-origins=yes", "./a.out"] },
    "risk_level": "low",
    "cli_support": ["claude", "gemini", "opencode", "codex"],
    "tags": ["debugging", "memory", "profiling"],
    "github": "https://sourceware.org/git/valgrind.git",
    "security": { "trust_level": "verified", "last_checked": "2026-04-03" }
  },
  {
    "id": "conan",
    "name": "Conan",
    "type": "cli",
    "category": ["build", "package-management"],
    "languages": ["c", "cpp"],
    "description": "C/C++ package manager that integrates with CMake, Meson, and Visual Studio — reproducible cross-platform dependency resolution",
    "when_to_use": "C/C++ projects tired of vendoring dependencies or reinventing package management",
    "install": { "command": "pip install conan", "binary_name": "conan" },
    "run": { "command": "conan", "common_flags": ["install .", "build .", "create ."] },
    "risk_level": "medium",
    "cli_support": ["claude", "gemini", "opencode", "codex"],
    "tags": ["package-manager", "dependencies"],
    "github": "https://github.com/conan-io/conan",
    "security": { "trust_level": "verified", "last_checked": "2026-04-03" }
  },
  {
    "id": "gtest",
    "name": "GoogleTest",
    "type": "library",
    "category": ["test"],
    "languages": ["c", "cpp"],
    "description": "Google's C++ testing and mocking framework — xUnit-style, fixtures, death tests, parameterized tests",
    "when_to_use": "Default choice for C++ unit testing",
    "install": { "command": "Add googletest as a submodule or via Conan", "binary_name": "" },
    "run": { "command": "ctest", "common_flags": ["--output-on-failure"] },
    "risk_level": "low",
    "cli_support": ["claude", "gemini", "opencode", "codex"],
    "tags": ["test", "google"],
    "github": "https://github.com/google/googletest",
    "security": { "trust_level": "verified", "last_checked": "2026-04-03" }
  }
]
